Description,URL,Price,Rating,Review Count
"YESMINI Kids Headphones, Foldable, Adjustable Headband with 3.5mm Jack, Volume Limited Safe, Lightweight On-Ear Earphones for Children Boys Girls’ Cellphones Laptop Computer Mp3/4 (Black)",https://www.amazon.com/gp/slredirect/picassoRedirect.html/ref=pa_sp_mtf_aps_sr_pg1_1?ie=UTF8&adId=A0307967H3OGZ4IUWZAP&qualifier=1680144086&id=4438532689417803&widgetName=sp_mtf&url=%2FHeadphones-Adjustable-Lightweight-Earphones-Cellphones%2Fdp%2FB08LDVX15P%2Fref%3Dsr_1_12_sspa%3Fkeywords%3DHeadphones%2Benergy%2Bsistem%26qid%3D1680144086%26sr%3D8-12-spons%26psc%3D1,$13.99,4.7 out of 5 stars,(101)
"iJoy Ultra Wireless Headphones with Microphone- Rechargeable Over Ear Wireless Bluetooth Headphones with 10Hr Playtime, SD Slot, Backup Wire- Soft Cushion Wireless Headset with Mic (Pink)",https://www.amazon.com/iJoy-Headphones-Microphone-Rechargeable-Bluetooth/dp/B09YSVNP77/ref=sr_1_13?keywords=Headphones+energy+sistem&qid=1680144086&sr=8-13,$24.99,3.9 out of 5 stars,(502)
"ZIHNIC Active Noise Cancelling Headphones, 40H Playtime Wireless Bluetooth Headset with Deep Bass Hi-Fi Stereo Sound,Comfortable Earpads for Travel/Home/Office (Rose Gold)",https://www.amazon.com/ZIHNIC-Cancelling-Headphones-Bluetooth-Comfortable/dp/B09DYKXXNT/ref=sr_1_14?keywords=Headphones+energy+sistem&qid=1680144086&sr=8-14,$59.99,4.4 out of 5 stars,"(3,658)"
"Soundcore Anker Life Q20 Hybrid Active Noise Cancelling Headphones, Wireless Over Ear Bluetooth Headphones, 40H Playtime, Hi-Res Audio, Deep Bass, Memory Foam Ear Cups, for Travel, Home Office",https://www.amazon.com/Soundcore-Cancelling-Headphones-Wireless-Bluetooth/dp/B07NM3RSRQ/ref=sr_1_15?keywords=Headphones+energy+sistem&qid=1680144086&sr=8-15,$59.99,4.5 out of 5 stars,"(49,136)"
"DOQAUS Bluetooth Headphones Over Ear, 52 Hours Playtime Wireless Headphones with 3 EQ Modes, Noise Isolating HiFi Stereo Headphones with Deep Bass, Microphone, Soft Earpads for Cellphone/PC (Black)",https://www.amazon.com/gp/slredirect/picassoRedirect.html/ref=pa_sp_mtf_aps_sr_pg1_1?ie=UTF8&adId=A01918761LXCMOIYXCN3F&qualifier=1680144086&id=4438532689417803&widgetName=sp_mtf&url=%2FDOQAUS-Bluetooth-Headphones-Wireless-Microphone%2Fdp%2FB08PY9LYQ8%2Fref%3Dsr_1_17_sspa%3Fkeywords%3DHeadphones%2Benergy%2Bsistem%26qid%3D1680144086%26sr%3D8-17-spons%26psc%3D1,$29.99,4.4 out of 5 stars,"(6,998)"
UNIVERSAL SPIN: Bluetooth Headphones | TWS Wireless Earbuds Stereo Earphone | Ultra-Light & Premium Deep Bass |Wonderful Music Quality | One Step Pairing | Law Power Consumption | User-Friendly Design,https://www.amazon.com/gp/slredirect/picassoRedirect.html/ref=pa_sp_atf_next_aps_sr_pg2_1?ie=UTF8&adId=A082485831SGPH97UWRGN&qualifier=1680144089&id=2337989748981502&widgetName=sp_atf_next&url=%2FUNIVERSAL-SPIN-Ultra-Light-Consumption-User-Friendly%2Fdp%2FB09S42BHZ4%2Fref%3Dsr_1_17_sspa%3Fkeywords%3DHeadphones%2Benergy%2Bsistem%26qid%3D1680144089%26sr%3D8-17-spons%26psc%3D1,$19.99,,
"Riwbox Bluetooth Headphones, XBT-80 Folding Stereo Wireless Bluetooth Headphones Over Ear with Microphone and Volume Control, Wireless and Wired Headset for PC/Cell Phones/TV/iPad (Black Gold)",https://www.amazon.com/gp/slredirect/picassoRedirect.html/ref=pa_sp_atf_next_aps_sr_pg2_1?ie=UTF8&adId=A0857114101K7PPGEPUX4&qualifier=1680144089&id=2337989748981502&widgetName=sp_atf_next&url=%2FBluetooth-Headphones-Riwbox-Wireless-Microphone%2Fdp%2FB0798NR83K%2Fref%3Dsr_1_18_sspa%3Fkeywords%3DHeadphones%2Benergy%2Bsistem%26qid%3D1680144089%26sr%3D8-18-spons%26psc%3D1%26smid%3DA3M8T49S1KQUCN,$30.85,4.3 out of 5 stars,"(8,913)"
TOZO T6 True Wireless Earbuds Bluetooth 5.3 Headphones Touch Control with Wireless Charging Case IPX8 Waterproof Stereo Earphones in-Ear Built-in Mic Headset Premium Deep Bass Black (2022 Upgraded),https://www.amazon.com/TOZO-T6-Bluetooth-Headphones-Waterproof/dp/B07RGZ5NKS/ref=sr_1_19?keywords=Headphones+energy+sistem&qid=1680144089&sr=8-19,$26.99,4.4 out of 5 stars,"(215,490)"
"Sennheiser HD 400S Closed Back, Around Ear Headphone with One-Button Smart Remote on Detachable Cable",https://www.amazon.com/Sennheiser-HD-400S-One-Button-Detachable/dp/B07NFQ9FQQ/ref=sr_1_20?keywords=Headphones+energy+sistem&qid=1680144089&sr=8-20,$48.95,4.3 out of 5 stars,"(1,522)"
"Bluetooth Headphones Wireless, pollini 40H Playtime Foldable Over Ear Headphones with Microphone, Deep Bass Stereo Headset with Soft Memory-Protein Earmuffs for iPhone/Android Cell Phone/PC(Rose Gold)",https://www.amazon.com/Bluetooth-Headphones-Wireless-Memory-Protein-Earmuffs/dp/B0823XS234/ref=sr_1_21?keywords=Headphones+energy+sistem&qid=1680144089&sr=8-21,$31.99,4.4 out of 5 stars,"(10,698)"
"TREBLAB Z2 | Over Ear Workout Headphones with Microphone | Bluetooth 5.0, Active Noise Cancelling (ANC) | Up to 35H Battery Life | Wireless Headphones for Sport, Workout, Running, Gym",https://www.amazon.com/TREBLAB-Headphones-Cancelling-Microphone-Auriculare/dp/B0778V7RVR/ref=sr_1_22?keywords=Headphones+energy+sistem&qid=1680144089&sr=8-22,$89.97,4.3 out of 5 stars,"(6,206)"
sephia SP3060 Earbuds Wired in Ear Headphones with Tangle-Free Cord Noise Isolating Earphones Deep Bass Case Ear Buds 3.5 mm Jack Plug,https://www.amazon.com/SP3060-Isolating-Earphones-Headphones-BlackBerry/dp/B0170RBJ9Q/ref=sr_1_24?keywords=Headphones+energy+sistem&qid=1680144089&sr=8-24,$14.95,4.3 out of 5 stars,"(32,292)"
"Panasonic Headphones, Lightweight Over the Ear Wired Headphones with Clear Sound and XBS for Extra Bass, Long Cord, 3.5mm Jack for Phones and Laptops – RP-HT161-K (Black)",https://www.amazon.com/Panasonic-Headphones-RP-HT161-K-Lightweight-Long-Corded/dp/B075LT8YLR/ref=sr_1_25?keywords=Headphones+energy+sistem&qid=1680144089&sr=8-25,$17.70,4.3 out of 5 stars,"(28,102)"
"Sony MDRZX110NC Noise Cancelling Headphones, Black",https://www.amazon.com/Sony-MDRZX110NC-Noise-Cancelling-Headphones/dp/B00NG57H4S/ref=sr_1_26?keywords=Headphones+energy+sistem&qid=1680144089&sr=8-26,$38.00,4.2 out of 5 stars,"(10,721)"
"iJoy Ultra Wireless Headphones with Microphone- Rechargeable Over Ear Wireless Bluetooth Headphones with 10Hr Playtime, SD Slot, Backup Wire- Soft Cushion Wireless Headset with Mic (Black)",https://www.amazon.com/gp/slredirect/picassoRedirect.html/ref=pa_sp_mtf_aps_sr_pg2_1?ie=UTF8&adId=A0113574PSR2R7EYHEOA&qualifier=1680144089&id=2337989748981502&widgetName=sp_mtf&url=%2FiJoy-Headphones-Microphone-Rechargeable-Bluetooth%2Fdp%2FB09YTFD4LS%2Fref%3Dsr_1_27_sspa%3Fkeywords%3DHeadphones%2Benergy%2Bsistem%26qid%3D1680144089%26sr%3D8-27-spons%26psc%3D1,$21.99,3.9 out of 5 stars,(502)
Wireless Ear Clip Bone Conduction Headphones Headset Clip On Open Ear Earbuds Bone Conduction Earbuds Head Set Workout Cycling Running Bluetooth Work Headphones Bone Conducting Induction Earphones,https://www.amazon.com/gp/slredirect/picassoRedirect.html/ref=pa_sp_mtf_aps_sr_pg2_1?ie=UTF8&adId=A00293261B4TNNR9JR13T&qualifier=1680144089&id=2337989748981502&widgetName=sp_mtf&url=%2FConduction-Headphones-Bluetooth-Conducting-Induction%2Fdp%2FB0BY1KV3ZT%2Fref%3Dsr_1_28_sspa%3Fkeywords%3DHeadphones%2Benergy%2Bsistem%26qid%3D1680144089%26sr%3D8-28-spons%26psc%3D1%26smid%3DAWQZHOZ0UXMBP,$34.99,4.0 out of 5 stars,(2)
"TUINYO Wireless Headphones Over Ear, Bluetooth Headphones with Microphone, Foldable Stereo Wireless Headset-Rose Gold",https://www.amazon.com/Bluetooth-Headphones-Microphone-Lightweight-Cellphone/dp/B07ZBJPYRK/ref=sr_1_29?keywords=Headphones+energy+sistem&qid=1680144089&sr=8-29,$28.99,4.4 out of 5 stars,"(17,272)"
TAGRY Bluetooth Headphones True Wireless Earbuds 60H Playback LED Power Display Earphones with Wireless Charging Case IPX5 Waterproof in-Ear Earbuds with Mic for TV Smart Phone Computer Laptop Sports,https://www.amazon.com/Wireless-Earbuds-TAGRY-Bluetooth-Earphones/dp/B09LD1T57H/ref=sr_1_31?keywords=Headphones+energy+sistem&qid=1680144089&sr=8-31,$29.73,4.5 out of 5 stars,"(37,439)"
"HROEENOI Wireless Bluetooth Active Noise Cancelling Deep Bass Over Ear Headphones with CVC 8.0 Microphone, Wireless Gaming Headset for Pc, 40 Hours Playtime for Travel Work Phone- Black",https://www.amazon.com/Cancelling-Headphones-HROEENOI-JZ02-Microphone/dp/B08T67XB4T/ref=sr_1_32?keywords=Headphones+energy+sistem&qid=1680144089&sr=8-32,$45.99,4.4 out of 5 stars,"(4,067)"
"Sony WF-1000XM4 Industry Leading Noise Canceling Truly Wireless Earbud Headphones with Alexa Built-in, Black",https://www.amazon.com/Sony-WF-1000XM4-Industry-Canceling-Headphones/dp/B094C4VDJZ/ref=sr_1_33?keywords=Headphones+energy+sistem&qid=1680144089&sr=8-33,$198.00,4.3 out of 5 stars,"(18,908)"
"PHILIPS PH805 Active Noise Canceling (ANC) Over Ear Wireless Bluetooth Performance Headphones w/Hi-Res Audio, Comfort Fit and 30 Hours of Playtime (TAPH805BK)",https://www.amazon.com/Philips-Performance-PH805-Headphones-Audio/dp/B08232DXKL/ref=sr_1_34?keywords=Headphones+energy+sistem&qid=1680144089&sr=8-34,$84.99,4.1 out of 5 stars,"(1,269)"
"Bang & Olufsen Beoplay EX - Wireless Bluetooth Earphones with Microphone and Active Noise Cancelling, Waterproof, 20 Hours of Playtime",https://www.amazon.com/Bang-Olufsen-Beoplay-Microphone-Cancelling/dp/B09VLHMD7H/ref=sr_1_35?keywords=Headphones+energy+sistem&qid=1680144089&sr=8-35,$399.00,4.2 out of 5 stars,(430)
"Sony WH-1000XM4 Wireless Premium Noise Canceling Overhead Headphones with Mic for Phone-Call and Alexa Voice Control, Silver",https://www.amazon.com/Sony-WH-1000XM4-Canceling-Headphones-phone-call/dp/B0863FR3S9/ref=sr_1_36?keywords=Headphones+energy+sistem&qid=1680144089&sr=8-36,$348.00,4.7 out of 5 stars,"(48,007)"
Wireless Earbuds Bluetooth Headphones 120H Playtime IPX7 Waterproof in-Ear Earphones Power Display Ear Buds with Mic and 2600mAh Charging Case for Sports Workout Laptop TV Computer Phone Gaming Black,https://www.amazon.com/gp/slredirect/picassoRedirect.html/ref=pa_sp_btf_aps_sr_pg2_1?ie=UTF8&adId=A01846242C784AOBM0BK7&qualifier=1680144089&id=2337989748981502&widgetName=sp_btf&url=%2FWireless-Bluetooth-Headphones-Waterproof-Earphones%2Fdp%2FB0BQ767QZY%2Fref%3Dsr_1_37_sspa%3Fkeywords%3DHeadphones%2Benergy%2Bsistem%26qid%3D1680144089%26sr%3D8-37-spons%26psc%3D1,$34.99,4.8 out of 5 stars,(804)
"August Wireless Gaming Earbuds EPG500B - Bluetooth Gaming Earbuds Headphones Dual Mic, Low Latency, USB-C Charging Case, IPX4 Water Resistance, Tactile, 40 Hours Battery Life",https://www.amazon.com/gp/slredirect/picassoRedirect.html/ref=pa_sp_btf_aps_sr_pg2_1?ie=UTF8&adId=A09584081IFZ49XPW7CUA&qualifier=1680144089&id=2337989748981502&widgetName=sp_btf&url=%2FGaming-Earbuds-Bluetooth-True-Wireless%2Fdp%2FB09CYGK7QP%2Fref%3Dsr_1_38_sspa%3Fkeywords%3DHeadphones%2Benergy%2Bsistem%26qid%3D1680144089%26sr%3D8-38-spons%26psc%3D1,$34.95,3.5 out of 5 stars,(22)
TWEE Bone Conduction Headphones Ultralight Swimming Headphones IPX8 Waterproof Bluetooth Headset with Microphone Open Ear Wireless Sports Earbuds with MP3 Player 16G Memory for Running (Blue),https://www.amazon.com/gp/slredirect/picassoRedirect.html/ref=pa_sp_atf_next_aps_sr_pg3_1?ie=UTF8&adId=A0505155385AUPT1QLWX2&qualifier=1680144091&id=4822087658497195&widgetName=sp_atf_next&url=%2FBone-Conduction-Headphones-Waterproof-Ultralight%2Fdp%2FB09VNL5PW3%2Fref%3Dsr_1_33_sspa%3Fkeywords%3DHeadphones%2Benergy%2Bsistem%26qid%3D1680144091%26sr%3D8-33-spons%26psc%3D1,$198.91,3.3 out of 5 stars,(3)
Wireless Earbuds with Earhooks Mini Bone Conduction Headphones Waterproof Bluetooth Open Ear Earbuds Cycling Earpiece Noise Canceling Headset Sports Bluetooth 5.0 Earphones Headset for Cycling Driving,https://www.amazon.com/gp/slredirect/picassoRedirect.html/ref=pa_sp_atf_next_aps_sr_pg3_1?ie=UTF8&adId=A08793333481A7GRGOZTP&qualifier=1680144091&id=4822087658497195&widgetName=sp_atf_next&url=%2FConduction-Headphones-Waterproof-Bluetooth-Canceling%2Fdp%2FB098D8RNHY%2Fref%3Dsr_1_34_sspa%3Fkeywords%3DHeadphones%2Benergy%2Bsistem%26qid%3D1680144091%26sr%3D8-34-spons%26psc%3D1%26smid%3DA7A2VE8XJ3ZZS,$26.99,3.5 out of 5 stars,(391)
"Premium Classroom Headphone with Microphone (5 Pack) - Kids Wired Earphones with Mic for School Students K-12 & Teachers, Soft Swivel On Ear Pads- Perfect for E-Learning, Meetings, Calls -(Colorful)",https://www.amazon.com/Classroom-Headphone-Earphones-Microphone-Learning/dp/B09C9XBFWP/ref=sr_1_35?keywords=Headphones+energy+sistem&qid=1680144091&sr=8-35,$39.97,4.5 out of 5 stars,(755)
"Puro Sound Labs: PuroPro Hybrid Active Noise Cancelling Volume Limiting Headphones, Wireless Over Ear Bluetooth Headphones, 32h Playtime, Hi-Res Audio, Memory Foam Ear Cups, for Travel and Home Office",https://www.amazon.com/Puro-Sound-Labs-Cancelling-Headphones/dp/B087QV671C/ref=sr_1_37?keywords=Headphones+energy+sistem&qid=1680144091&sr=8-37,$149.00,4.2 out of 5 stars,(91)
"Waterproof Over-Ear Headphones, V5.0 HD Stereo Sound Sports Wireless Over-Ear Headphones with Mic, Passive Noise Cancelling Headsets, 9 Hours Battery for Gym Running Workout Men, Women",https://www.amazon.com/Waterproof-Over-Ear-Headphones-Wireless-Cancelling/dp/B07V225763/ref=sr_1_38?keywords=Headphones+energy+sistem&qid=1680144091&sr=8-38,$19.99,4.1 out of 5 stars,"(1,882)"
"233621 Hush Active Noise Cancelling Headphones with Microphone [100 Hrs Playtime] Wireless Over Ear ANC Headphones Wireless Bluetooth Headphones with Custom App for Travel, Home Office(Cozmo)",https://www.amazon.com/233621-Cancelling-Headphones-Lightweight-Headphones/dp/B08HYWCQNS/ref=sr_1_41?keywords=Headphones+energy+sistem&qid=1680144091&sr=8-41,$64.99,4.0 out of 5 stars,(301)
"Bose QuietComfort 35 II Wireless Bluetooth Headphones, Noise-Cancelling, with Alexa Voice Control - Black",https://www.amazon.com/Bose-QuietComfort-Wireless-Headphones-Cancelling/dp/B0756CYWWD/ref=sr_1_42?keywords=Headphones+energy+sistem&qid=1680144091&sr=8-42,$344.99,4.7 out of 5 stars,"(62,267)"
"iJoy Ultra Wireless Headphones with Microphone- Rechargeable Over Ear Wireless Bluetooth Headphones with 10Hr Playtime, SD Slot, Backup Wire- Soft Cushion Wireless Headset with Mic (Blue)",https://www.amazon.com/gp/slredirect/picassoRedirect.html/ref=pa_sp_mtf_aps_sr_pg3_1?ie=UTF8&adId=A01134181O67U92BORR5X&qualifier=1680144091&id=4822087658497195&widgetName=sp_mtf&url=%2FiJoy-Headphones-Microphone-Rechargeable-Bluetooth%2Fdp%2FB09YT44F5F%2Fref%3Dsr_1_43_sspa%3Fkeywords%3DHeadphones%2Benergy%2Bsistem%26qid%3D1680144091%26sr%3D8-43-spons%26psc%3D1,$24.99,3.9 out of 5 stars,(502)
TWEE Bone Conduction Headphones IPX8 Waterproof for Swimming 16G Player Wireless Bluetooth Headset Open Ear Sports Earphones Earbuds with Microphones for Swimming Cycling Workout,https://www.amazon.com/gp/slredirect/picassoRedirect.html/ref=pa_sp_mtf_aps_sr_pg3_1?ie=UTF8&adId=A09325653DUZGGLO8JLND&qualifier=1680144091&id=4822087658497195&widgetName=sp_mtf&url=%2FBone-Conduction-Headphones-Waterproof-Swimming%2Fdp%2FB09VY46FPG%2Fref%3Dsr_1_44_sspa%3Fkeywords%3DHeadphones%2Benergy%2Bsistem%26qid%3D1680144091%26sr%3D8-44-spons%26psc%3D1,$228.99,4.2 out of 5 stars,(3)
AILIHEN C8 Wired Headphones with Microphone and Volume Control Folding Lightweight Corded Headset for Cellphones Tablets Chromebook Phones Smartphones Laptop Computer PC Mp3/4 (Grey/Mint),https://www.amazon.com/AILIHEN-C8-Headphones-Lightweight-Smartphones/dp/B01EF5DBYM/ref=sr_1_45?keywords=Headphones+energy+sistem&qid=1680144091&sr=8-45,$19.98,4.3 out of 5 stars,"(28,832)"
"Wireless Earbud, Sport Bluetooth 5.1 Headphones with Earhooks Wireless Earphones in-Ear with Immersive Sound, Bluetooth Earbud IP7 Waterproof, Noise Cancelling, Dual LED Display, 48H Playtime, Running",https://www.amazon.com/Bluetooth-Headphones-Earphones-Waterproof-Cancelling/dp/B09GPKX5SN/ref=sr_1_46?keywords=Headphones+energy+sistem&qid=1680144091&sr=8-46,$39.99,4.3 out of 5 stars,"(14,765)"
"PowerLocus Wireless Bluetooth Over-Ear Stereo Foldable Headphones, Wired Headsets with Built-in Microphone for iPhone, Samsung, LG, iPad (Rose Gold)",https://www.amazon.com/PowerLocus-Wireless-Bluetooth-Headphones-Microphone/dp/B06XT8L1YF/ref=sr_1_47?keywords=Headphones+energy+sistem&qid=1680144091&sr=8-47,$22.99,4.5 out of 5 stars,"(23,580)"
"SENNHEISER HD 450BT Bluetooth 5.0 Wireless Headphone with Active Noise Cancellation - 30-Hour Battery Life, USB-C Fast Charging, Virtual Assistant Button, Foldable - Black",https://www.amazon.com/Sennheiser-HD-450BT-Bluetooth-Cancellation/dp/B083W7V3RG/ref=sr_1_50?keywords=Headphones+energy+sistem&qid=1680144091&sr=8-50,$149.95,4.2 out of 5 stars,"(5,253)"
"LG TONE Free True Wireless Bluetooth FP9 - Active Noise Cancelling Earbuds with UVnano Charging Case, Black",https://www.amazon.com/LG-Tone-Free-FP9-Cancelling/dp/B098V1GRL3/ref=sr_1_51?keywords=Headphones+energy+sistem&qid=1680144091&sr=8-51,$109.99,4.2 out of 5 stars,"(1,910)"
"SHANLING MG800 Dynamic Driver Headphones Wired Earbuds Hi-Res in-Ear HiFi Earphones,Titanium Cavity,2.5mm/3.5mm/4.4mm Plug,MMCX,Replaceable Audio Filters, IEMs Lossless for Phone/Player/PC/Tablet",https://www.amazon.com/SHANLING-MG800-Headphones-Earphones-Replaceable/dp/B0BD3C73Q3/ref=sr_1_52?keywords=Headphones+energy+sistem&qid=1680144091&sr=8-52,$899.99,4.0 out of 5 stars,(1)
"HiBy WH2 TWS Bluetooth Headphones, True Hi-Fi Wireless, Single Dynamic/Touch Control/app control/IPX4/Dual Microphone",https://www.amazon.com/gp/slredirect/picassoRedirect.html/ref=pa_sp_btf_aps_sr_pg3_1?ie=UTF8&adId=A052295123GXN28D2BMJC&qualifier=1680144091&id=4822087658497195&widgetName=sp_btf&url=%2FHiBy-Bluetooth-Headphones-Wireless-Microphone%2Fdp%2FB0BKT4CB1Z%2Fref%3Dsr_1_53_sspa%3Fkeywords%3DHeadphones%2Benergy%2Bsistem%26qid%3D1680144091%26sr%3D8-53-spons%26psc%3D1,$79.00,2.5 out of 5 stars,(3)
"Kinglucky Wireless Bone Conduction Headphones, Open-Ear Bluetooth Sport Headphones - Sweat Resistant Earphones for Cycling,Workouts and Night Running - Built-in Noise Cancelling Mic(Black)",https://www.amazon.com/gp/slredirect/picassoRedirect.html/ref=pa_sp_btf_aps_sr_pg3_1?ie=UTF8&adId=A082079915IES0UGKC8IA&qualifier=1680144091&id=4822087658497195&widgetName=sp_btf&url=%2FKinglucky-Wireless-Conduction-Headphones-Bluetooth%2Fdp%2FB0B6TTKT1W%2Fref%3Dsr_1_54_sspa%3Fkeywords%3DHeadphones%2Benergy%2Bsistem%26qid%3D1680144091%26sr%3D8-54-spons%26psc%3D1,$29.99,3.9 out of 5 stars,(153)
